id,date,podcast_id,episode,link,duration
1,03/01/2023,1,Optimise your brain,https://open.spotify.com/episode/0n2qAM8Vwc4lMbToaCmDSW?si=d7272fd214c24749,91
2,04/01/2023,2,Not A Lot of Cop,https://open.spotify.com/episode/1qxWsRSTVW4MyB0bFqDfJ7?si=1930800b25c54245,58
3,05/01/2023,3,Edinburgh Fringe Festival,https://open.spotify.com/episode/6IRmLKyKXLVh6bIf1UGDMN?si=cf1c9f8fccc6405d,31
4,20/01/2023,4,Jesse Lingard,https://open.spotify.com/episode/5Cci0tzSWEgH0OzoAwSEAp?si=7f8de422ca5d4867,76
5,21/01/2023,4,Dr. Tali Short,https://open.spotify.com/episode/4EQMgPo0PVwhQ01N9EsscL?si=3fbb2e2581774c42,99
6,23/01/2023,5,Back Yourself Into The Future,https://open.spotify.com/episode/4A2FY2kfdgmkYJSuMX2Xno?si=cfb5745cd49442de,36
7,24/01/2023,2,School's out for winter!,https://open.spotify.com/episode/4h9jf2EdEJXXRKVUdqdfXv?si=cce63cca8ae045c7,54
8,26/01/2023,6,The Truth About Population Collapse,https://open.spotify.com/episode/2p61DHoEOsAMvPjoVgT8G0?si=b1dc15dddd3b446a,48
9,28/01/2023,7,My Son Hates His Own Home,https://open.spotify.com/episode/6rbL8AVK4YfJCZCUhLa0Qh?si=d7e6aaac573e42bb,47
10,29/01/2023,2,Death by 100 tiny scandals,https://open.spotify.com/episode/4h9jf2EdEJXXRKVUdqdfXv?si=693418b762114ffe,54
11,10/02/2023,8,Messi economics,https://open.spotify.com/episode/5AJB2BTp7RExSGpbQlIsXI?si=fe5fdeddb9ca4439,28
12,22/02/2023,4,Steven Peters,https://open.spotify.com/episode/6G7iyHKDaxiKcDqJPlVyiA?si=f8e85488339b41a5,124
13,24/02/2023,5,History Makers,https://open.spotify.com/episode/7eUeeCFsXkjp7LEkDZCVuv?si=ab8bbbcef5114b68,32
14,02/03/2023,6,How Likely Are you To Die in a Nuclear War,https://open.spotify.com/episode/0afVUqprJo1cEBpXzeiQ2v?si=49b3cfe90065401b,49
15,04/03/2023,9,That Pele Episode,https://open.spotify.com/episode/54Bk2K9Gv274AiJrbaZAqM?si=4908f040242d4d36,48
16,06/03/2023,10,Ginni Rometty: IBM CEO,https://open.spotify.com/episode/0w5YDgA71WKzfV20kqJPWm?si=65b859ff32864dbc,111
17,09/03/2023,6,The Bruce Willis Deepfake Is Everyone's Problem,https://open.spotify.com/episode/1b5eRPpFakOJo1eijyPA2j?si=a9ed29559542467a,26
18,14/03/2023,6,A Danish City Built Google Into Its Schools,https://open.spotify.com/episode/0GPOaNEuBW4GP4MLOkVHBU?si=52e23d9074024e83,40
19,30/03/2023,6,The Origings of Covid Are More Complicated Than Once Thought,https://open.spotify.com/episode/7uSCZpYBs8mycJa4BeYUF7?si=e601a35c2e3548c1,33
20,12/04/2023,12,Inside UBS' takeover of Credit Suisse,https://open.spotify.com/episode/0yM5kMokngTRe6m5eE8OMB?si=6e86e6e098cc4247,25
21,12/04/2023,12,Climate crisis: Who should pay to rebuild Pakistan?,https://open.spotify.com/episode/2xthVlpfRP29NGcUrz5qQO?si=6b31f138f6dd4bef,19
22,26/05/2023,13,Green Energy Will Be Bigger Than The Internet,https://open.spotify.com/episode/16kvCysUEMzDjtX4AN9JyN?si=1fe2d73b4d9c4978,41
23,27/05/2023,13,Using Nature For Packaging,https://open.spotify.com/episode/0tX2jG21n6fB61xStUwmzI?si=9dfee7273ef245c8,34
24,11/06/2023,5,The Ashes Preview,https://open.spotify.com/episode/5Der7JAMbrboX1duZihfoJ?si=12269b24996844d4,37
25,20/06/2023,5,The Wait Is Over,https://open.spotify.com/episode/5VhZX3Eg89J7nXzFYRsBPl?si=7931ff35158b4a87,46
26,20/06/2023,1,Sleep Toolkit: Tools for Optimizing Sleep & Sleep-Wake Timing,https://open.spotify.com/episode/3TxjF2mZy9S9I9GL5eZ8sq?si=fd14be2e978c4aca,99
27,21/06/2023,5,Edgbaston (What a Test Match!),https://open.spotify.com/episode/1TuNv3dQmnk8Mkyba9ZnWm?si=19fc4a4a3b38497c,54
28,02/07/2023,11,Andrej Karpathy: Tesla AI, Self-Driving, Optimus, Aliens, and AGI,https://open.spotify.com/episode/28yFp9dzo61CiOf0Ejxxhe?si=344ba88318d64cf2,208
29,04/07/2023,1,Dr. David Spiegel: Using Hypnosis to Enhance Health & Performance,https://open.spotify.com/episode/7D4AMFgSu30RYOXHpDULrD?si=1d34ac3a470c4731,109
30,16/07/2023,11,Sam Altman: OpenAI CEO on GPT-4, ChatGPT, and the Future of AI,https://open.spotify.com/episode/6rAOusZcsuNtCv8mefmwND?si=32d35cd20c964b41,143
31,22/07/2023,1,How To Enhance Performance & Learning by Applying a Growth Mindset,https://open.spotify.com/episode/727AkttspFFAjfm8D9fBB5?si=bd6045c1fd2b4a85,101
32,22/07/2023,6,Plant-Based Burgers Aren't Denting People's Beef Addiction,https://open.spotify.com/episode/4T33kATQe3l8lHp4t8HE1E?si=f35022be19e84c58,42
33,03/08/2023,14,The health benefits of eating together,https://open.spotify.com/episode/0FozRc7X3739NKzr6BFpSi?si=64e2f9ecd2634f22,13
34,03/08/2023,14,What breaks a fast - The Big IF,https://open.spotify.com/episode/1TQPcqIWDP70GguDIQUym9?si=24c6482abeed47c6,8
35,03/08/2023,14,What does science say about intermittent fasting?,https://open.spotify.com/episode/1cYW1uBshjp7dvrbBjObQa?si=b68b86f3229844dc,47
36,03/08/2023,14,Should you avoid late night snacks - The Big IF,https://open.spotify.com/episode/4GSj2GjO1srAFhBQMyYn2E?si=7c7a5c8e175c4e9e,6
37,03/08/2023,14,Does calorie counting work? - The Big IF,https://open.spotify.com/episode/4TUnyV4zkr89C0IGzh1Rvh?si=2791dd1d5c0c4f58,9
38,12/08/2023,5,You Could Not Write It,https://open.spotify.com/episode/7zEPyuuyRiIAthPHmwFi4v?si=2ab4e9c3aa814746,61
39,12/09/2023,6,Europe's Plan to Wean Itself off Russian Gas Might Just Work,https://open.spotify.com/episode/56xwuz395JEyF8bXYYKKbK?si=734e0f8018384013,45
40,15/09/2023,15,The great rush for battery metals,https://open.spotify.com/episode/56xwuz395JEyF8bXYYKKbK?si=734e0f8018384013,61
41,02/02/2024,16,Why is everyone choosing to stay single?,https://open.spotify.com/episode/5gXq6btM8l7bAgdAXkqQ6k?si=2f6517cc9d074c38,104
42,20/03/2024,11,Sam Altman,https://open.spotify.com/episode/0Bx6gWK755bUoM238X2Ma1?si=fc61564744d24d9d,114
43,29/03/2024,17,Jessica Ennis-Hill: Don't let anyone push you around,https://open.spotify.com/episode/3srVbN4v24wg1KtBuhhqcD?si=3042c47596f9482a,76
44,02/04/2024,18,AI and Neuroscience: The virtuous cycle,https://open.spotify.com/episode/2pyGPjaLxbkh5TPxHGQgLq?si=f4d9bf4e2c994d3e,34
45,14/04/2024,19,HARDEST GEEZER’s First Exclusive Podcast Since Running The Length of Africa!,https://open.spotify.com/episode/3IXdfbf420YmLzAvuu9mBd?si=38b35efc96e54b47,86
46,31/05/2024,4,Russ Cook (Hardest Geezer),https://open.spotify.com/episode/1I5RYSf6KZ9EUEx2CUw9Vz?si=cc22344120fb46d8,124
47,06/06/2024,20,Why our brains are bad at climate change,https://open.spotify.com/episode/0gzos773vhTXIc9rJdJkmS?si=2e2835b595744933,24
48,07/06/2024,21,Episode One: Good Luck,https://open.spotify.com/episode/7m23kUqtqxYI3IrE4v1Qcd?si=b21254d932a446eb,39
49,14/06/2024,17,Paul McKenna,
50,20/06/2024,9, he-Changing Crosses' EUROS...
51,01/07/2024,22,Woeful England's Great Escape,
52,11/07/2024,5,Pads Off: Jimmy/Mattchin
53,13/07/2025,22,Watkins Stunner Fires England To Final,https://open.spotify.com/episode/18dVhi7euUb2DlG55KRbhU?si=4406e6e7158c453a,23
54,13/07/2024,22,Mainoo Magic, Wonderful Watkins & Southgate On The Brink Of Footballing Immortality,25
55,05/09/2024,23,Donald Trump Interview,https://open.spotify.com/episode/2jesNeddpvEHo4m5k8eOmo?si=b5debf4569ff41db,63
56,08/09/2024,19,LUKE LITTLER - The Nuke's First Exclusive Podcast!,https://open.spotify.com/episode/2o7tMPprcwQQdodgCaVXcq?si=341d602379fe494b,68
57,18/09/2024,11,Yann Lecun: Meta AI, Open Source, Limits of LLMs, AGI & the Future of AI,https://open.spotify.com/episode/0bXyQJAylGg7E5mZnyHhNb?si=7795ac778de74805,166

Add category for pod id >= 24
58,18/09/2024,10,#435 - Andrew Huberman,
59,20/09/2024,10,#440 - Pieter Levels
60,21/09/2024,24,Relocation of remote workers...
61,21/09/2024,25,Pieter Levels
62,22/09/2024,26,Reinventing mining ...
63,11/10/2024,Lex Fridman TBC,#76 - ...
64,11/10/2024,9,Brits Abroad: Did Crouch ...
65,28/10/2024,11,#447 - Cursor Team
66,04/11/2024,27,Jamie Carragher: the Red ...
67,23/11/2024,28,Lisbon,
68,30/11/2024,1,Dr. Peter Attia: Supplements
69,28/01/2025,1,Leaverage Dopamine to ...
70,12/02/2025,11,#459 - DeepSeek,